department,catalogNumber,description,catoid,coid,coreCode,coreArea
CHIN,3354,Chinese Culture and Language,41,193919,81,Writing in the Disciplines
DANC,2303,Introduction to Dance,41,194325,81,Writing in the Disciplines
DANC,3310,Dance History I,41,194338,81,Writing in the Disciplines
HIST,2328,Chicano History since 1910,41,195090,81,Writing in the Disciplines
HON,3310,Poetics and Performance,41,195207,81,Writing in the Disciplines
IART,2300,The Arts in Houston,41,201493,81,Writing in the Disciplines
COSC,1336,Computer Science and Programming,41,194158,91,Mathematics/Reasoning
CUIN,1350,Mathematics for Teachers 1,41,197493,91,Mathematics/Reasoning
MATH,1324,Finite Math with Applications,41,195725,91,Mathematics/Reasoning
MATH,1325,Calculus for Business & Social Sciences,41,195726,91,Mathematics/Reasoning
MATH,1342,Elementary Statistical Methods,41,195734,91,Mathematics/Reasoning
MATH,1351,Introduction to Mathematical Reasoning,41,195724,91,Mathematics/Reasoning
MATH,2312,Precalculus,41,195727,91,Mathematics/Reasoning
MATH,2413,Calculus I,41,195729,91,Mathematics/Reasoning
MATH,2414,Calculus II,41,195730,91,Mathematics/Reasoning
